row_id,source_state_file,source_state_abbr,state,municipality,health_unit_name,address,phones_raw,cnes,antivenoms_raw,source_notes,state_clean,municipality_clean,health_unit_name_clean,address_clean,phones_clean,antivenoms_joined,geocode_query,normalization_notes,needs_review_pre_geocode,geocode_status,formatted_address,lat,lng,place_id,partial_match,location_type,result_types,geocode_provider,geocode_attempted_at,original_formatted_address,original_lat,original_lng,original_place_id,original_partial_match,original_location_type,original_review_reasons,repair_applied,repair_source,repair_outcome,final_status,publish_policy
PA_0115,PA.json,PA,PARÁ,Pau D'arco,Hospital Municipal Enfermeira Antônia Pinheiro Cavalcante,"Rua Vivaldo Lima Nunes, s/n - Setor Paraíso",(94) 99127-9554,2615991,Botrópico|Escorpiônico|Fonêutrico|Loxoscélico,,PARÁ,Pau D'arco,Hospital Municipal Enfermeira Antônia Pinheiro Cavalcante,"Rua Vivaldo Lima Nunes, s/n - Setor Paraíso",(94) 99127-9554,"Botrópico, Escorpiônico, Fonêutrico, Loxoscélico","Hospital Municipal Enfermeira Antônia Pinheiro Cavalcante, Rua Vivaldo Lima Nunes, s/n - Setor Paraíso, Pau D'arco, PARÁ, Brasil",,false,OK,"Pau D'Arco - PA, 68545-000, Brasil",-7.8322956,-50.0401129,ChIJ30W_aKZ74JIRhQCdvKhmdZs,true,APPROXIMATE,administrative_area_level_2|political,google_maps_geocoding_v1,2026-04-19T14:54:50Z,,,,,,,,false,,,retry_queue,publish
PA_0117,PA.json,PA,PARÁ,Prainha,Hospital Wilson Ribeiro,,,2331756,Botrópico|Escorpiônico|Fonêutrico|Loxoscélico,"address, phone blank in source",PARÁ,Prainha,Hospital Wilson Ribeiro,,,"Botrópico, Escorpiônico, Fonêutrico, Loxoscélico","Hospital Wilson Ribeiro, Prainha, PARÁ, Brasil",address empty; phones empty,false,OK,"Tv. Paes de Carvalho - Prainha, PA, 68130-000, Brasil",-1.8045386,-53.4813461,ChIJR7A4bIubhZIRIiGtL12vXOo,false,GEOMETRIC_CENTER,establishment|health|hospital|point_of_interest,google_maps_geocoding_v1,2026-04-19T14:54:50Z,,,,,,,,false,,,watchlist,publish
PA_0120,PA.json,PA,PARÁ,Porto de Moz,Hospital Municipal Ana Nery,"Rua da República, 1780 - Centro",(93) 99130-8303,2711184,Botrópico|Escorpiônico|Fonêutrico|Loxoscélico,,PARÁ,Porto de Moz,Hospital Municipal Ana Nery,"Rua da República, 1780 - Centro",(93) 99130-8303,"Botrópico, Escorpiônico, Fonêutrico, Loxoscélico","Hospital Municipal Ana Nery, Rua da República, 1780 - Centro, Porto de Moz, PARÁ, Brasil",,false,OK,"R. da República, 1780 - Porto de Moz, PA, 68330-000, Brasil",-1.7554456,-52.2377273,EjxSLiBkYSBSZXDDumJsaWNhLCAxNzgwIC0gUG9ydG8gZGUgTW96LCBQQSwgNjgzMzAtMDAwLCBCcmF6aWwiMRIvChQKEgkxZWNA1JOakhGeNZIeYcSM_xD0DSoUChIJT0yTodKTmpIRL65ulzyZNyI,true,RANGE_INTERPOLATED,street_address,google_maps_geocoding_v1,2026-04-19T14:54:51Z,,,,,,,,false,,,retry_queue,publish
PA_0121,PA.json,PA,PARÁ,Portel,Hospital Municipal de Saúde de Portel,"Avenida Augusto Montenegro, s/n - Centro",(91) 98502-6894,2676923,Botrópico|Escorpiônico|Fonêutrico|Loxoscélico,,PARÁ,Portel,Hospital Municipal de Saúde de Portel,"Avenida Augusto Montenegro, s/n - Centro",(91) 98502-6894,"Botrópico, Escorpiônico, Fonêutrico, Loxoscélico","Hospital Municipal de Saúde de Portel, Avenida Augusto Montenegro, s/n - Centro, Portel, PARÁ, Brasil",,false,OK,"Av. Augusto Montenegro, Portel - PA, 68480-000, Brasil",-1.9339747,-50.8153827,ChIJO_9sfhl9l5IRKTsL8YlCDGs,true,GEOMETRIC_CENTER,route,google_maps_geocoding_v1,2026-04-19T14:54:51Z,,,,,,,,false,,,retry_queue,publish
PA_0122,PA.json,PA,PARÁ,Quatipuru,Unidade Mista/Ubs,Rua Bernadino Gomes,(91) 984155649,2677024,Botrópico|Escorpiônico|Fonêutrico|Loxoscélico,,PARÁ,Quatipuru,Unidade Mista/Ubs,Rua Bernadino Gomes,(91) 984155649,"Botrópico, Escorpiônico, Fonêutrico, Loxoscélico","Unidade Mista/Ubs, Rua Bernadino Gomes, Quatipuru, PARÁ, Brasil",,false,OK,"R. Bernadino Gomes - Quatipuru, PA, 68709-000, Brasil",-0.8964809,-47.0069924,ChIJj3V1t8Uyr5IRAp0kfXGgmvo,true,GEOMETRIC_CENTER,route,google_maps_geocoding_v1,2026-04-19T14:54:51Z,,,,,,,,false,,,retry_queue,publish
PA_0128,PA.json,PA,PARÁ,Rio Maria,Hospital Municipal de Rio Maria,"Avenida 08, 341 - Setor Remor",(94) 99124-7675,2317990,Botrópico|Escorpiônico|Fonêutrico|Loxoscélico,,PARÁ,Rio Maria,Hospital Municipal de Rio Maria,"Avenida 08, 341 - Setor Remor",(94) 99124-7675,"Botrópico, Escorpiônico, Fonêutrico, Loxoscélico","Hospital Municipal de Rio Maria, Avenida 08, 341 - Setor Remor, Rio Maria, PARÁ, Brasil",,false,OK,"Av. Rio Maria, 8 - 341, Rio Maria - PA, 68530-000, Brasil",-7.3103957,-50.0429714,EjlBdi4gUmlvIE1hcmlhLCA4IC0gMzQxLCBSaW8gTWFyaWEgLSBQQSwgNjg1MzAtMDAwLCBCcmF6aWwiORo3CjASLgoUChIJM6kX3vKg4JIRULfU6dPX3zwQCCoUChIJ0YYp8V6g4JIRRE5IGXwKrNkSAzM0MQ,true,RANGE_INTERPOLATED,street_address|subpremise,google_maps_geocoding_v1,2026-04-19T14:54:53Z,,,,,,,,false,,,retry_queue,publish
PA_0133,PA.json,PA,PARÁ,Santa Cruz do Arari,Unidade Mista de Santa Cruz do Arari,"Rua Victor Moreira, 01 - Centro",(91) 3658-2219,2316161,Botrópico|Escorpiônico|Fonêutrico|Loxoscélico,,PARÁ,Santa Cruz do Arari,Unidade Mista de Santa Cruz do Arari,"Rua Victor Moreira, 01 - Centro",(91) 3658-2219,"Botrópico, Escorpiônico, Fonêutrico, Loxoscélico","Unidade Mista de Santa Cruz do Arari, Rua Victor Moreira, 01 - Centro, Santa Cruz do Arari, PARÁ, Brasil",,false,OK,"Santa Cruz do Arari, PA, 68850-000, Brasil",-0.6645966999999999,-49.1729676,ChIJf1cOY_ESoZIRLY3_eJTt3iw,true,APPROXIMATE,locality|political,google_maps_geocoding_v1,2026-04-19T14:54:55Z,,,,,,,,false,,,retry_queue,publish
PA_0136,PA.json,PA,PARÁ,Santa Barbara do Pará,Centro Especial de Urgencia e Emergencia Santa Bárbara do PA,"Rua Carvalho Braga, s/n - Centro",(91) 98605-8445,236846,Botrópico,,PARÁ,Santa Barbara do Pará,Centro Especial de Urgencia e Emergencia Santa Bárbara do PA,"Rua Carvalho Braga, s/n - Centro",(91) 98605-8445,Botrópico,"Centro Especial de Urgencia e Emergencia Santa Bárbara do PA, Rua Carvalho Braga, s/n - Centro, Santa Barbara do Pará, PARÁ, Brasil",,false,OK,"R. Maria Carvalho Braga - Piracá Miri, Santa Bárbara do Pará - PA, 68798-000, Brasil",-1.228487,-48.2948816,EldSLiBNYXJpYSBDYXJ2YWxobyBCcmFnYSAtIFBpcmFjw6EgTWlyaSwgU2FudGEgQsOhcmJhcmEgZG8gUGFyw6EgLSBQQSwgNjg3OTgtMDAwLCBCcmF6aWwiLiosChQKEgkNsSs88kSkkhHXkIhoFGLgRhIUChIJdTE0eTNEpJIRl1JH8Kr3tNk,true,GEOMETRIC_CENTER,route,google_maps_geocoding_v1,2026-04-19T14:54:55Z,,,,,,,,false,,,retry_queue,publish
PA_0137,PA.json,PA,PARÁ,Santa Maria das Barreiras,Hosp. Mun. de Santa Maria das Barreiras,"Avenida Dom Sebastião Tomaz, s/n - Centro",(94) 3319-3152,2333589,Botrópico|Escorpiônico|Fonêutrico|Loxoscélico,,PARÁ,Santa Maria das Barreiras,Hosp. Mun. de Santa Maria das Barreiras,"Avenida Dom Sebastião Tomaz, s/n - Centro",(94) 3319-3152,"Botrópico, Escorpiônico, Fonêutrico, Loxoscélico","Hosp. Mun. de Santa Maria das Barreiras, Avenida Dom Sebastião Tomaz, s/n - Centro, Santa Maria das Barreiras, PARÁ, Brasil",,false,OK,"Av. Dom Sebastião Tomás - Santa Maria das Barreiras, PA, 68565-000, Brasil",-8.8717368,-49.7157068,ChIJLUUSBqPHIZMRlhgQWCVISsg,true,GEOMETRIC_CENTER,route,google_maps_geocoding_v1,2026-04-19T14:54:56Z,,,,,,,,false,,,retry_queue,publish
PA_0138,PA.json,PA,PARÁ,Santa Maria das Barreiras,PSF ll Antonio Manoel de Melo,"Vila Sawanopolis, s/n - Centro",(94) 3319-1346,3916065,Botrópico|Escorpiônico|Fonêutrico|Loxoscélico,,PARÁ,Santa Maria das Barreiras,PSF ll Antonio Manoel de Melo,"Vila Sawanopolis, s/n - Centro",(94) 3319-1346,"Botrópico, Escorpiônico, Fonêutrico, Loxoscélico","PSF ll Antonio Manoel de Melo, Vila Sawanopolis, s/n - Centro, Santa Maria das Barreiras, PARÁ, Brasil",,false,OK,"Santa Maria das Barreiras - PA, 68565-000, Brasil",-8.870501299999999,-49.7168256,ChIJYYWrPx6aH5MRHvUJmnL5Doo,true,APPROXIMATE,administrative_area_level_2|political,google_maps_geocoding_v1,2026-04-19T14:54:56Z,,,,,,,,false,,,retry_queue,publish
PA_0139,PA.json,PA,PARÁ,Santa Maria do Pará,Hospital da Ordem Terceira Unidade de Santa Maria doo Pará,"Rua Cezarino Doce, 10 - Centro",(91) 3442-1107,2674785,Botrópico|Crotálico|Laquético|Escorpiônico|Fonêutrico|Loxoscélico,,PARÁ,Santa Maria do Pará,Hospital da Ordem Terceira Unidade de Santa Maria doo Pará,"Rua Cezarino Doce, 10 - Centro",(91) 3442-1107,"Botrópico, Crotálico, Laquético, Escorpiônico, Fonêutrico, Loxoscélico","Hospital da Ordem Terceira Unidade de Santa Maria doo Pará, Rua Cezarino Doce, 10 - Centro, Santa Maria do Pará, PARÁ, Brasil",,false,OK,"R. Cesarino Doce, 10, Santa Maria do Pará - PA, 68738-000, Brasil",-1.3536024,-47.5822971,EkJSLiBDZXNhcmlubyBEb2NlLCAxMCwgU2FudGEgTWFyaWEgZG8gUGFyw6EgLSBQQSwgNjg3MzgtMDAwLCBCcmF6aWwiMBIuChQKEgnD1t1zdnilkhFvnTIdE9V87xAKKhQKEgnbc3JnnYKlkhGpjsCIDzzPBA,true,RANGE_INTERPOLATED,street_address,google_maps_geocoding_v1,2026-04-19T14:54:56Z,,,,,,,,false,,,retry_queue,publish
PA_0140,PA.json,PA,PARÁ,Santana do Araguaia,Hosp. Municipal de São Francisco de Assis,"Avenida Vinicius de Freitas, s/n - Bel Recanto",(94) 3431-2871,2329565,Botrópico|Escorpiônico|Fonêutrico|Loxoscélico,,PARÁ,Santana do Araguaia,Hosp. Municipal de São Francisco de Assis,"Avenida Vinicius de Freitas, s/n - Bel Recanto",(94) 3431-2871,"Botrópico, Escorpiônico, Fonêutrico, Loxoscélico","Hosp. Municipal de São Francisco de Assis, Avenida Vinicius de Freitas, s/n - Bel Recanto, Santana do Araguaia, PARÁ, Brasil",,false,OK,"Santana do Araguaia - PA, 68560-000, Brasil",-9.336633299999999,-50.3413872,ChIJFzo3JWXXGJMRAp5LN2sxiFo,true,APPROXIMATE,administrative_area_level_2|political,google_maps_geocoding_v1,2026-04-19T14:54:57Z,,,,,,,,false,,,retry_queue,publish
PA_0147,PA.json,PA,PARÁ,São Felix do Xingu,Unidade Municipal Materno Infantil N. S. das Mercês,"Avenida Antonio Marques Ribeiro, 1900 (anexo) - Centro",(94) 3435-1579,2694530,Botrópico|Escorpiônico|Fonêutrico|Loxoscélico,,PARÁ,São Felix do Xingu,Unidade Municipal Materno Infantil N. S. das Mercês,"Avenida Antonio Marques Ribeiro, 1900 (anexo) - Centro",(94) 3435-1579,"Botrópico, Escorpiônico, Fonêutrico, Loxoscélico","Unidade Municipal Materno Infantil N. S. das Mercês, Avenida Antonio Marques Ribeiro, 1900 (anexo) - Centro, São Felix do Xingu, PARÁ, Brasil",,false,OK,"Av. Antônio Marquês Ribeiro - São Félix do Xingu, PA, 68380-000, Brasil",-6.6411924,-51.99062259999999,ChIJIY-2aSWq5ZIRqWmHHMfVkbo,true,GEOMETRIC_CENTER,church|establishment|place_of_worship|point_of_interest|tourist_attraction,google_maps_geocoding_v1,2026-04-19T14:54:59Z,,,,,,,,false,,,retry_queue,publish
PA_0154,PA.json,PA,PARÁ,São João do Araguaia,Hospital Municipal Mário Martins,"Rodovia Pedro Carneiro, s/n - Novo São João",(94) 3778-1329,2312387,Botrópico|Escorpiônico|Fonêutrico|Loxoscélico,,PARÁ,São João do Araguaia,Hospital Municipal Mário Martins,"Rodovia Pedro Carneiro, s/n - Novo São João",(94) 3778-1329,"Botrópico, Escorpiônico, Fonêutrico, Loxoscélico","Hospital Municipal Mário Martins, Rodovia Pedro Carneiro, s/n - Novo São João, São João do Araguaia, PARÁ, Brasil",,false,OK,"Rod. Pedro Carneiro - São João do Araguaia, PA, 68518-000, Brasil",-5.3616448,-48.7909234,EkNSb2QuIFBlZHJvIENhcm5laXJvIC0gU8OjbyBKb8OjbyBkbyBBcmFndWFpYSwgUEEsIDY4NTE4LTAwMCwgQnJhemlsIi4qLAoUChIJbwV2XDF_w5IRYzKgolEBJ24SFAoSCaXkqsNJf8OSEXUf9vQbC2UU,true,GEOMETRIC_CENTER,route,google_maps_geocoding_v1,2026-04-19T14:55:01Z,,,,,,,,false,,,retry_queue,publish
PA_0156,PA.json,PA,PARÁ,São Sebastião da Boa Vista,Unidade Mista de São Sebastião Boa Vista,"Avenida das Acácias, s/n - Centro",(91) 3764-1534,2316021,Botrópico|Escorpiônico|Fonêutrico|Loxoscélico,,PARÁ,São Sebastião da Boa Vista,Unidade Mista de São Sebastião Boa Vista,"Avenida das Acácias, s/n - Centro",(91) 3764-1534,"Botrópico, Escorpiônico, Fonêutrico, Loxoscélico","Unidade Mista de São Sebastião Boa Vista, Avenida das Acácias, s/n - Centro, São Sebastião da Boa Vista, PARÁ, Brasil",,false,OK,"Av. das Acácias, São Sebastião da Boa Vista - PA, 68820-000, Brasil",-1.7210524,-49.5301226,ChIJgWXmRNbEopIRAOFvXdY5VWA,true,GEOMETRIC_CENTER,route,google_maps_geocoding_v1,2026-04-19T14:55:02Z,,,,,,,,false,,,retry_queue,publish
PA_0158,PA.json,PA,PARÁ,Soure,Hosp. Municipal Menino Deus,"8ª Rua, s/n - Matinha",(91)3741-1425,2316552,Botrópico|Escorpiônico|Fonêutrico|Loxoscélico,,PARÁ,Soure,Hosp. Municipal Menino Deus,"8ª Rua, s/n - Matinha",(91)3741-1425,"Botrópico, Escorpiônico, Fonêutrico, Loxoscélico","Hosp. Municipal Menino Deus, 8ª Rua, s/n - Matinha, Soure, PARÁ, Brasil",,false,OK,"R. Oitava - Matinha, Soure - PA, 68870-000, Brasil",-0.7288401,-48.5122618,ChIJa226c3q5ppIRWpUnye4V6oA,true,GEOMETRIC_CENTER,establishment|health|hospital|point_of_interest,google_maps_geocoding_v1,2026-04-19T14:55:02Z,,,,,,,,false,,,retry_queue,publish
PA_0159,PA.json,PA,PARÁ,Tailândia,Hospital Geral de Tailândia,Av Florianopolis S/N Bairro Novo,(91) 3752-2131,6779069,Botrópico|Escorpiônico|Fonêutrico|Loxoscélico,,PARÁ,Tailândia,Hospital Geral de Tailândia,Av Florianopolis S/N Bairro Novo,(91) 3752-2131,"Botrópico, Escorpiônico, Fonêutrico, Loxoscélico","Hospital Geral de Tailândia, Av Florianopolis S/N Bairro Novo, Tailândia, PARÁ, Brasil",,false,OK,"Av. Florianópolis - Bairro Novo, Tailândia - PA, 68695-000, Brasil",-2.9360251,-48.9486472,ChIJvxtPgLykvpIRDg880zLU2IM,false,GEOMETRIC_CENTER,establishment|health|hospital|point_of_interest,google_maps_geocoding_v1,2026-04-19T14:55:02Z,,,,,,,,false,,,watchlist,publish
PA_0163,PA.json,PA,PARÁ,Tracuateua,Hospital Municipal de Tracuateua,"AVENIDA BRAGNÇA s/n, Nova Esperança",(91) 985111813,6425542,Botrópico|Escorpiônico|Fonêutrico|Loxoscélico,,PARÁ,Tracuateua,Hospital Municipal de Tracuateua,"AVENIDA BRAGNÇA s/n, Nova Esperança",(91) 985111813,"Botrópico, Escorpiônico, Fonêutrico, Loxoscélico","Hospital Municipal de Tracuateua, AVENIDA BRAGNÇA s/n, Nova Esperança, Tracuateua, PARÁ, Brasil",,false,OK,"Av. Bragança, Tracuateua - PA, 68647-000, Brasil",-1.0793144,-46.8990318,ChIJ-b4UHXwhr5IRlxgGFexdQHM,true,GEOMETRIC_CENTER,establishment|health|hospital|point_of_interest,google_maps_geocoding_v1,2026-04-19T14:55:03Z,,,,,,,,false,,,retry_queue,publish
PA_0166,PA.json,PA,PARÁ,Quatipuru,Unidade Mista/UBS,Rua Bernadino Gomes,(91) 984155649,2677024,Botrópico|Escorpiônico|Fonêutrico|Loxoscélico,duplicate entry in source (Quatipuru appears on page 10 and page 13 with same CNES),PARÁ,Quatipuru,Unidade Mista/UBS,Rua Bernadino Gomes,(91) 984155649,"Botrópico, Escorpiônico, Fonêutrico, Loxoscélico","Unidade Mista/UBS, Rua Bernadino Gomes, Quatipuru, PARÁ, Brasil",,false,OK,"R. Bernadino Gomes - Quatipuru, PA, 68709-000, Brasil",-0.8964809,-47.0069924,ChIJj3V1t8Uyr5IRAp0kfXGgmvo,true,GEOMETRIC_CENTER,route,google_maps_geocoding_v1,2026-04-19T14:55:04Z,,,,,,,,false,,,retry_queue,publish
PA_0167,PA.json,PA,PARÁ,Ulianópolis,Hospital Municipal de Ulianopolis,"Rua Bahia, s/n - Caminho das Árvores",(91) 98136-6525,2317028,Botrópico|Escorpiônico|Fonêutrico|Loxoscélico,,PARÁ,Ulianópolis,Hospital Municipal de Ulianopolis,"Rua Bahia, s/n - Caminho das Árvores",(91) 98136-6525,"Botrópico, Escorpiônico, Fonêutrico, Loxoscélico","Hospital Municipal de Ulianopolis, Rua Bahia, s/n - Caminho das Árvores, Ulianópolis, PARÁ, Brasil",,false,OK,"Ulianópolis - PA, 68632-000, Brasil",-3.7444209,-47.4986002,ChIJ_X8qLqn_x5IRAGMB1AEtxPc,true,GEOMETRIC_CENTER,establishment|health|hospital|point_of_interest,google_maps_geocoding_v1,2026-04-19T14:55:04Z,,,,,,,,false,,,retry_queue,publish
PA_0168,PA.json,PA,PARÁ,Uruará,Hospital Municipal de Uruará,"Avenida Pará, 268 - Centro",(93) 3532-1366,2537028,Botrópico|Escorpiônico|Fonêutrico|Loxoscélico,,PARÁ,Uruará,Hospital Municipal de Uruará,"Avenida Pará, 268 - Centro",(93) 3532-1366,"Botrópico, Escorpiônico, Fonêutrico, Loxoscélico","Hospital Municipal de Uruará, Avenida Pará, 268 - Centro, Uruará, PARÁ, Brasil",,false,OK,"Av. Pará, 268 - Uruará, PA, 68140-000, Brasil",-3.7184136,-53.7347025,Ei9Bdi4gUGFyw6EsIDI2OCAtIFVydWFyw6EsIFBBLCA2ODE0MC0wMDAsIEJyYXppbCIxEi8KFAoSCSGWIYnU7IySEfD_N1KaIC6DEIwCKhQKEgkHrBJr0uyMkhH_38sBY-Ki3Q,true,RANGE_INTERPOLATED,street_address,google_maps_geocoding_v1,2026-04-19T14:55:05Z,,,,,,,,false,,,retry_queue,publish
PA_0169,PA.json,PA,PARÁ,Vigia,Hospital Municipal de Vigia,"Avenida Barão de Guajará, s/n - Castanheira",(91) 3731-1248,2314002,Botrópico|Escorpiônico|Fonêutrico|Loxoscélico,,PARÁ,Vigia,Hospital Municipal de Vigia,"Avenida Barão de Guajará, s/n - Castanheira",(91) 3731-1248,"Botrópico, Escorpiônico, Fonêutrico, Loxoscélico","Hospital Municipal de Vigia, Avenida Barão de Guajará, s/n - Castanheira, Vigia, PARÁ, Brasil",,false,OK,"R. Barão de Guajará - Vigia, PA, 68780-000, Brasil",-0.8581435,-48.1405095,ChIJVRhYD2uBppIR2tPPiP0co14,true,GEOMETRIC_CENTER,route,google_maps_geocoding_v1,2026-04-19T14:55:05Z,,,,,,,,false,,,retry_queue,publish
PA_0172,PA.json,PA,PARÁ,Xinguara,Unidade de Pronto Atendimento de Xinguara,"BR-155 Esquina com Avenida Hermes Dantas, s/n - Centro",(94) 99280-4653,7155840,Botrópico|Crotálico|Laquético|Escorpiônico|Fonêutrico|Loxoscélico,,PARÁ,Xinguara,Unidade de Pronto Atendimento de Xinguara,"BR-155 Esquina com Avenida Hermes Dantas, s/n - Centro",(94) 99280-4653,"Botrópico, Crotálico, Laquético, Escorpiônico, Fonêutrico, Loxoscélico","Unidade de Pronto Atendimento de Xinguara, BR-155 Esquina com Avenida Hermes Dantas, s/n - Centro, Xinguara, PARÁ, Brasil",,false,OK,"BR-155 - Xinguara, PA, Brasil",-7.1042579,-49.9369105,Eh1CUi0xNTUgLSBYaW5ndWFyYSwgUEEsIEJyYXppbCIuKiwKFAoSCX3p3BFMJSCTEel1BYcqPK9SEhQKEglbKhPeLgHekhHSWLS1tNFsEQ,true,GEOMETRIC_CENTER,route,google_maps_geocoding_v1,2026-04-19T14:55:06Z,,,,,,,,false,,,retry_queue,publish
PB_0006,PB.json,PB,PARAÍBA,Patos,Hospital Infatil Noaldo Leite,R. Hildo Menezes - Juá Doce. CEP 58704-540,(83) 3423-2501,2605481,Botrópico|Crotálico|Elapídico|Escorpiônico e Aracnídico,,PARAÍBA,Patos,Hospital Infatil Noaldo Leite,R. Hildo Menezes - Juá Doce. CEP 58704-540,(83) 3423-2501,"Botrópico, Crotálico, Elapídico, Escorpiônico e Aracnídico","Hospital Infatil Noaldo Leite, R. Hildo Menezes - Juá Doce. CEP 58704-540, Patos, PARAÍBA, Brasil",,false,OK,"R. Hildo Menezes - Juá Doce, Patos - PB, 58704-540, Brasil",-7.0150058,-37.2810975,ChIJ8zaRXcthrwcR00btp1RBFbQ,true,GEOMETRIC_CENTER,establishment|health|hospital|point_of_interest,google_maps_geocoding_v1,2026-04-19T14:55:08Z,,,,,,,,false,,,retry_queue,publish
PB_0012,PB.json,PB,PARAÍBA,Princesa Isabel,Hospital Regional Deputado José Pereira de Lima,R. Teotônio Carlos de Andrade,(83) 3457-2585,2321637,Botrópico|Crotálico|Elapídico|Escorpiônico e Aracnídico,,PARAÍBA,Princesa Isabel,Hospital Regional Deputado José Pereira de Lima,R. Teotônio Carlos de Andrade,(83) 3457-2585,"Botrópico, Crotálico, Elapídico, Escorpiônico e Aracnídico","Hospital Regional Deputado José Pereira de Lima, R. Teotônio Carlos de Andrade, Princesa Isabel, PARAÍBA, Brasil",,false,OK,"R. Teotônio Carlos de Andrade, Princesa Isabel - PB, 58755-000, Brasil",-7.7367197,-37.9783883,ChIJV8J2Tp34pgcR55RH3uZm0zQ,true,GEOMETRIC_CENTER,route,google_maps_geocoding_v1,2026-04-19T14:55:10Z,,,,,,,,false,,,retry_queue,publish
PB_0013,PB.json,PB,PARAÍBA,Itabaiana,Hospital Regional de Itabaiana Sebastião Rodrigues de Melo,Av. Dep. Adauto Pereira da Silva - Nova Itabaiana - Itabaiana - CEP 58360-000,(83) 3281-2640,6644996,Botrópico|Crotálico|Elapídico|Escorpiônico e Aracnídico,,PARAÍBA,Itabaiana,Hospital Regional de Itabaiana Sebastião Rodrigues de Melo,Av. Dep. Adauto Pereira da Silva - Nova Itabaiana - Itabaiana - CEP 58360-000,(83) 3281-2640,"Botrópico, Crotálico, Elapídico, Escorpiônico e Aracnídico","Hospital Regional de Itabaiana Sebastião Rodrigues de Melo, Av. Dep. Adauto Pereira da Silva - Nova Itabaiana - Itabaiana - CEP 58360-000, Itabaiana, PARAÍBA, Brasil",,false,OK,"R. Sebastião Rodrigues de Melo - Lirios do Vale, Itabaiana - PB, 58360-000, Brasil",-7.3258309,-35.3286035,ChIJ1_SGoENkrAcR0nto7OMJXg4,true,GEOMETRIC_CENTER,route,google_maps_geocoding_v1,2026-04-19T14:55:10Z,,,,,,,,false,,,retry_queue,publish
PB_0014,PB.json,PB,PARAÍBA,Sousa,Hospital Regional Manoel Gonçalves de Abrantes,"Rua José Fagundes de Lira, S/N, Jardins. CEP 58802-180",(83) 3522- 6183,2504537,Botrópico|Crotálico|Elapídico|Escorpiônico e Aracnídico,,PARAÍBA,Sousa,Hospital Regional Manoel Gonçalves de Abrantes,"Rua José Fagundes de Lira, S/N, Jardins. CEP 58802-180",(83) 3522- 6183,"Botrópico, Crotálico, Elapídico, Escorpiônico e Aracnídico","Hospital Regional Manoel Gonçalves de Abrantes, Rua José Fagundes de Lira, S/N, Jardins. CEP 58802-180, Sousa, PARAÍBA, Brasil",,false,OK,"R. José Fagundes de Lira - Lot. Raquel Gadelha, Sousa - PB, 58802-180, Brasil",-6.7637506,-38.2226136,Ek5SLiBKb3PDqSBGYWd1bmRlcyBkZSBMaXJhIC0gTG90LiBSYXF1ZWwgR2FkZWxoYSwgU291c2EgLSBQQiwgNTg4MDItMTgwLCBCcmF6aWwiLiosChQKEgknUF868FukBxEI0azsY-ScvxIUChIJ1_zVMe5bpAcRIy-TvpwzNBU,true,GEOMETRIC_CENTER,route,google_maps_geocoding_v1,2026-04-19T14:55:10Z,,,,,,,,false,,,retry_queue,publish
PE_0004,PE.json,PE,PERNAMBUCO,Garanhuns,Hospital Dom Moura,"Avenida Simoa Gomes, s/n - Heliópolis",(87) 3761-6100,2702983,Escorpiônico,,PERNAMBUCO,Garanhuns,Hospital Dom Moura,"Avenida Simoa Gomes, s/n - Heliópolis",(87) 3761-6100,Escorpiônico,"Hospital Dom Moura, Avenida Simoa Gomes, s/n - Heliópolis, Garanhuns, PERNAMBUCO, Brasil",,false,OK,"Heliópolis, Garanhuns - PE, Brasil",-8.881486299999999,-36.4764264,ChIJcYmewDoNBwcRpgCTZYhaaDo,true,APPROXIMATE,political|sublocality|sublocality_level_1,google_maps_geocoding_v1,2026-04-19T14:55:11Z,,,,,,,,false,,,retry_queue,publish
PE_0006,PE.json,PE,PERNAMBUCO,Jaboatão dos Guararapes,Hospital Jaboatão Prazeres,"Rua Recife, s/n - Cajueiro Seco",(81) 3184-4201,2711990,Escorpiônico,,PERNAMBUCO,Jaboatão dos Guararapes,Hospital Jaboatão Prazeres,"Rua Recife, s/n - Cajueiro Seco",(81) 3184-4201,Escorpiônico,"Hospital Jaboatão Prazeres, Rua Recife, s/n - Cajueiro Seco, Jaboatão dos Guararapes, PERNAMBUCO, Brasil",,false,OK,"R. Recife - Cajueiro Seco, Jaboatão dos Guararapes - PE, 54330-250, Brasil",-8.1671792,-34.9248232,ChIJHSCNFbzhqgcR6Tt15LkBMYo,true,GEOMETRIC_CENTER,route,google_maps_geocoding_v1,2026-04-19T14:55:12Z,,,,,,,,false,,,retry_queue,publish
PI_0001,PI.json,PI,PIAUÍ,Amarante,Hospital de Amarante,"Praça Padre Virgilio, s/n - Centro",(86) 3292-1121,2364883,Botrópico|Crotálico|Elapídico|Escorpiônico,V2 PDF used; PI source is image-based,PIAUÍ,Amarante,Hospital de Amarante,"Praça Padre Virgilio, s/n - Centro",(86) 3292-1121,"Botrópico, Crotálico, Elapídico, Escorpiônico","Hospital de Amarante, Praça Padre Virgilio, s/n - Centro, Amarante, PIAUÍ, Brasil",,false,OK,"Amarante, PI, 64400-000, Brasil",-6.2446652,-42.8530679,ChIJ_Wdj0IrfhAcRjNBbFM9S3xw,true,APPROXIMATE,locality|political,google_maps_geocoding_v1,2026-04-19T14:55:15Z,,,,,,,,false,,,retry_queue,publish
PI_0003,PI.json,PI,PIAUÍ,Bom Jesus,Hospital Regional de Bom Jesus,"Avenida Dr. Raimundo dos Santos, 546 - Centro",(89) 3562-1192/1404,2364816,Botrópico|Crotálico|Elapídico|Fonêutrico|Loxoscélico|Laquético|Escorpiônico,V2 PDF used; PI source is image-based,PIAUÍ,Bom Jesus,Hospital Regional de Bom Jesus,"Avenida Dr. Raimundo dos Santos, 546 - Centro",(89) 3562-1192/1404,"Botrópico, Crotálico, Elapídico, Fonêutrico, Loxoscélico, Laquético, Escorpiônico","Hospital Regional de Bom Jesus, Avenida Dr. Raimundo dos Santos, 546 - Centro, Bom Jesus, PIAUÍ, Brasil",,false,OK,"Bom Jesus, PI, 64900-000, Brasil",-9.071653699999999,-44.35934779999999,ChIJ8Qjy6A5NfAcRpPNrOivNxN8,true,APPROXIMATE,locality|political,google_maps_geocoding_v1,2026-04-19T14:55:16Z,,,,,,,,false,,,retry_queue,publish
PI_0005,PI.json,PI,PIAUÍ,Corrente,Hospital Regional Dr. João Pacheco Cavalcante,"Rua Antonio Nogueira de Carvalho, s/n - Centro",(89) 3573-1465/2699,2777770,Botrópico|Crotálico|Elapídico|Fonêutrico|Loxoscélico|Laquetico|Escorpiônico,V2 PDF used; PI source is image-based,PIAUÍ,Corrente,Hospital Regional Dr. João Pacheco Cavalcante,"Rua Antonio Nogueira de Carvalho, s/n - Centro",(89) 3573-1465/2699,"Botrópico, Crotálico, Elapídico, Fonêutrico, Loxoscélico, Laquetico, Escorpiônico","Hospital Regional Dr. João Pacheco Cavalcante, Rua Antonio Nogueira de Carvalho, s/n - Centro, Corrente, PIAUÍ, Brasil",,false,OK,"R. João Pacheco Cavalcante & R. Filemon Nogueira, Corrente - PI, 64980-000, Brasil",-10.4398715,-45.1660174,ElNSLiBKb8OjbyBQYWNoZWNvIENhdmFsY2FudGUgJiBSLiBGaWxlbW9uIE5vZ3VlaXJhLCBDb3JyZW50ZSAtIFBJLCA2NDk4MC0wMDAsIEJyYXppbCJmImQKFAoSCc3JJHD1OTOTESWekaL_hFovEhQKEgnNySRw9TkzkxElnpGi_4RaLxoUChIJA9DUO_U5M5MR7uUQk7JSAtgaFAoSCaFFo4H2OTOTEVXtfpRZRSiXIgoNhQDH-RVyNhTl,true,GEOMETRIC_CENTER,intersection,google_maps_geocoding_v1,2026-04-19T14:55:16Z,,,,,,,,false,,,retry_queue,publish
PI_0007,PI.json,PI,PIAUÍ,Fronteiras,Hosp. Mun. Noberto Angelo Pereira,"Rua José Aquiles de Sousa, s/n - Centro",(89) 3454-1152,2694301,Botrópico|Crotálico|Elapídico|Escorpiônico,V2 PDF used; PI source is image-based,PIAUÍ,Fronteiras,Hosp. Mun. Noberto Angelo Pereira,"Rua José Aquiles de Sousa, s/n - Centro",(89) 3454-1152,"Botrópico, Crotálico, Elapídico, Escorpiônico","Hosp. Mun. Noberto Angelo Pereira, Rua José Aquiles de Sousa, s/n - Centro, Fronteiras, PIAUÍ, Brasil",,false,OK,"Av. Jose Aquiles de Sousa, Fronteiras - PI, 64690-000, Brasil",-7.0784693,-40.6161314,ChIJA3bpYespnwcRtAXf1oLxQBQ,true,GEOMETRIC_CENTER,route,google_maps_geocoding_v1,2026-04-19T14:55:17Z,,,,,,,,false,,,retry_queue,publish
