row_id,source_state_file,source_state_abbr,state,municipality,health_unit_name,address,phones_raw,cnes,antivenoms_raw,source_notes,state_clean,municipality_clean,health_unit_name_clean,address_clean,phones_clean,antivenoms_joined,geocode_query,normalization_notes,needs_review_pre_geocode,geocode_status,formatted_address,lat,lng,place_id,partial_match,location_type,result_types,geocode_provider,geocode_attempted_at,original_formatted_address,original_lat,original_lng,original_place_id,original_partial_match,original_location_type,original_review_reasons,repair_applied,repair_source,repair_outcome,final_status,publish_policy
BA_0185,BA.json,BA,BAHIA,Poções,UPA 24H Vilobaldo Macedo,"Rua Santo Antonio, 590 - Indaiá",(77) 3431-5812,7592191,Botrópico|Escorpiônico,ATENDIMENTO=SIM,BAHIA,Poções,UPA 24H Vilobaldo Macedo,"Rua Santo Antonio, 590 - Indaiá",(77) 3431-5812,"Botrópico, Escorpiônico","UPA 24H Vilobaldo Macedo, Rua Santo Antonio, 590 - Indaiá, Poções, BAHIA, Brasil",,false,OK,"Av. Santo Antônio, 590, Poções - BA, 45260-000, Brasil",-14.5255327,-40.37509130000001,EjlBdi4gU2FudG8gQW50w7RuaW8sIDU5MCwgUG_Dp8O1ZXMgLSBCQSwgNDUyNjAtMDAwLCBCcmF6aWwiMRIvChQKEgljCUP9OQpHBxEKyYZ1jANwKRDOBCoUChIJuagiKjgKRwcRodaiC9UWX7o,true,RANGE_INTERPOLATED,street_address,google_maps_geocoding_v1,2026-04-19T14:49:59Z,,,,,,,,false,,,retry_queue,publish
BA_0187,BA.json,BA,BAHIA,Ponto Novo,Unidade Hospitalar Nossa Senhora de Fátima,"Rua São Jorge, s/n - Centro",(74) 3677-1387,2600714,Botrópico|Crotálico|Elapídico|Laquético|Escorpiônico|Araneídico,ATENDIMENTO=SIM,BAHIA,Ponto Novo,Unidade Hospitalar Nossa Senhora de Fátima,"Rua São Jorge, s/n - Centro",(74) 3677-1387,"Botrópico, Crotálico, Elapídico, Laquético, Escorpiônico, Araneídico","Unidade Hospitalar Nossa Senhora de Fátima, Rua São Jorge, s/n - Centro, Ponto Novo, BAHIA, Brasil",,false,OK,"R. São Jorge, Ponto Novo - BA, 44755-000, Brasil",-10.8648122,-40.1355894,ChIJiYtBTxswbQcRWViiZeATDyA,true,GEOMETRIC_CENTER,route,google_maps_geocoding_v1,2026-04-19T14:50:00Z,,,,,,,,false,,,retry_queue,publish
BA_0188,BA.json,BA,BAHIA,Porto Seguro,Hospital Luis Eduardo Magalhães,"BR 367, Km 56 Lot Quinta do Descobrimento, s/n – Cambolo",(73) 3288-4911,2802090,Botrópico|Crotálico|Escorpiônico e Araneídico,ATENDIMENTO=SIM,BAHIA,Porto Seguro,Hospital Luis Eduardo Magalhães,"BR 367, Km 56 Lot Quinta do Descobrimento, s/n – Cambolo",(73) 3288-4911,"Botrópico, Crotálico, Escorpiônico e Araneídico","Hospital Luis Eduardo Magalhães, BR 367, Km 56 Lot Quinta do Descobrimento, s/n – Cambolo, Porto Seguro, BAHIA, Brasil",,false,OK,"Rodovia 367, km 56, S/N - R. Sete - Porto Seguro, BA, 45810-000, Brasil",-16.4221712,-39.1012688,ChIJkwKf18STNgcRDpNeaWpu_VA,true,GEOMETRIC_CENTER,doctor|establishment|health|hospital|point_of_interest,google_maps_geocoding_v1,2026-04-19T14:50:00Z,,,,,,,,false,,,retry_queue,publish
BA_0193,BA.json,BA,BAHIA,Quijingue,Hospital Municipal de Quijique (Hosp. Munic. Antonio Imbassahy),"Rua Castro Alves, s/n - Centro",(75) 3487- 2153,2598221,"É suprido pela rede de frio quando do atendimento de ocorrência, dada a proximidade",ATENDIMENTO=SIM; supplied by cold chain network,BAHIA,Quijingue,Hospital Municipal de Quijique (Hosp. Munic. Antonio Imbassahy),"Rua Castro Alves, s/n - Centro",(75) 3487- 2153,"É suprido pela rede de frio quando do atendimento de ocorrência, dada a proximidade","Hospital Municipal de Quijique (Hosp. Munic. Antonio Imbassahy), Rua Castro Alves, s/n - Centro, Quijingue, BAHIA, Brasil",,false,OK,"R. Castro Alves - Quijingue, BA, 48830-000, Brasil",-10.7524919,-39.207798,ChIJC_Lc2fZkEgcRrmJ-UiD9XGk,true,GEOMETRIC_CENTER,route,google_maps_geocoding_v1,2026-04-19T14:50:02Z,,,,,,,,false,,,retry_queue,publish
BA_0195,BA.json,BA,BAHIA,Remanso,Hospital São Pedro,"Rua Epitácio Dias da Silva, 115 - quadra 07",(74) 3535-1051,2509369,Botrópico|Crotálico|Elapídico|Escorpiônico|Araneídico,ATENDIMENTO=SIM,BAHIA,Remanso,Hospital São Pedro,"Rua Epitácio Dias da Silva, 115 - quadra 07",(74) 3535-1051,"Botrópico, Crotálico, Elapídico, Escorpiônico, Araneídico","Hospital São Pedro, Rua Epitácio Dias da Silva, 115 - quadra 07, Remanso, BAHIA, Brasil",,false,OK,"R. Tomaz Rodrigues da Silva, 115 - quadra 07 - Remanso, BA, 47200-000, Brasil",-9.6126667,-42.0796229,Ek1SLiBUb21heiBSb2RyaWd1ZXMgZGEgU2lsdmEsIDExNSAtIHF1YWRyYSAwNyAtIFJlbWFuc28sIEJBLCA0NzIwMC0wMDAsIEJyYXppbCI_Gj0KMBIuChQKEgnLg0EJ1VlwBxG-_IYYR6tFCRBzKhQKEglrNBMd1VlwBxG3_gm80FevnhIJcXVhZHJhIDA3,true,RANGE_INTERPOLATED,street_address|subpremise,google_maps_geocoding_v1,2026-04-19T14:50:02Z,,,,,,,,false,,,retry_queue,publish
BA_0197,BA.json,BA,BAHIA,Ribeirão do Largo,Centro de Saúde Adelino Fernandes,"Rua Antonio Aquino de Carvalho, 55 - Centro",(77) 99151-5857,2509547,Aracnídeo|Botrópico,ATENDIMENTO=SIM,BAHIA,Ribeirão do Largo,Centro de Saúde Adelino Fernandes,"Rua Antonio Aquino de Carvalho, 55 - Centro",(77) 99151-5857,"Aracnídeo, Botrópico","Centro de Saúde Adelino Fernandes, Rua Antonio Aquino de Carvalho, 55 - Centro, Ribeirão do Largo, BAHIA, Brasil",,false,OK,"R. Antônio Aquino Alves de Carvalho, 55 - Ribeirão do Largo, BA, 45155-000, Brasil",-15.4587648,-40.7430307,ElRSLiBBbnTDtG5pbyBBcXVpbm8gQWx2ZXMgZGUgQ2FydmFsaG8sIDU1IC0gUmliZWlyw6NvIGRvIExhcmdvLCBCQSwgNDUxNTUtMDAwLCBCcmF6aWwiMBIuChQKEgnh22VbZPFIBxG5YDMe1rm5lxA3KhQKEgkDVwc2ZPFIBxHp8422oWrWTA,true,RANGE_INTERPOLATED,street_address,google_maps_geocoding_v1,2026-04-19T14:50:03Z,,,,,,,,false,,,retry_queue,publish
BA_0201,BA.json,BA,BAHIA,Salvador,UPA do Cabula,"Estrada do Saboeiro, s/n – Saboeiro",(71) 3387-4745,7596871,"É suprido pelo CIATox quando do atendimento de ocorrência, dada a proximidade",ATENDIMENTO=SIM; supplied by CIATox when needed,BAHIA,Salvador,UPA do Cabula,"Estrada do Saboeiro, s/n – Saboeiro",(71) 3387-4745,"É suprido pelo CIATox quando do atendimento de ocorrência, dada a proximidade","UPA do Cabula, Estrada do Saboeiro, s/n – Saboeiro, Salvador, BAHIA, Brasil",,false,OK,"R. Santa Bárbara do Saboeiro - Saboeiro, Salvador - BA, 41180-555, Brasil",-12.9576607,-38.4479656,ChIJVbIvg_QaFgcR7HhZn_nmaH8,true,GEOMETRIC_CENTER,route,google_maps_geocoding_v1,2026-04-19T14:50:04Z,,,,,,,,false,,,retry_queue,publish
BA_0202,BA.json,BA,BAHIA,Santa Cruz Cabrália,Hospital José Maria de Magalhães Neto,"BR 367, 80 – Mutary",(73) 3282-1188/1417,2510782,Botrópico|Crotálico|Escorpiônico e Araneídico,ATENDIMENTO=SIM,BAHIA,Santa Cruz Cabrália,Hospital José Maria de Magalhães Neto,"BR 367, 80 – Mutary",(73) 3282-1188/1417,"Botrópico, Crotálico, Escorpiônico e Araneídico","Hospital José Maria de Magalhães Neto, BR 367, 80 – Mutary, Santa Cruz Cabrália, BAHIA, Brasil",,false,OK,"BR-367, 80, Santa Cruz Cabrália - BA, 45807-000, Brasil",-16.282657,-39.0236629,EjhCUi0zNjcsIDgwLCBTYW50YSBDcnV6IENhYnLDoWxpYSAtIEJBLCA0NTgwNy0wMDAsIEJyYXppbCIwEi4KFAoSCUf-AaWE6TYHETULqjd0hVN3EFAqFAoSCc1MmCycXTYHEQpLePeGI815,true,RANGE_INTERPOLATED,street_address,google_maps_geocoding_v1,2026-04-19T14:50:05Z,,,,,,,,false,,,retry_queue,publish
BA_0208,BA.json,BA,BAHIA,Santo Amaro,Hospital Nossa Senhora das Vitórias,Distrito - Oliveira dos Campinhos,(75)3208-1070,2514621,Botrópico|Escorpiônico,ATENDIMENTO=SIM,BAHIA,Santo Amaro,Hospital Nossa Senhora das Vitórias,Distrito - Oliveira dos Campinhos,(75)3208-1070,"Botrópico, Escorpiônico","Hospital Nossa Senhora das Vitórias, Distrito - Oliveira dos Campinhos, Santo Amaro, BAHIA, Brasil",,false,OK,"Campinhos, Santo Amaro - BA, 44200-000, Brasil",-12.4231955,-38.7950242,ChIJvb0K05TTFQcRi-FKzQiktJQ,true,GEOMETRIC_CENTER,establishment|point_of_interest,google_maps_geocoding_v1,2026-04-19T14:50:06Z,,,,,,,,false,,,retry_queue,publish
BA_0210,BA.json,BA,BAHIA,São Domingos,Hospital São Domingos,Praça Izaque Pinheiro,75 98265-6665,4032101,"É suprido pela rede de frio quando do atendimento de ocorrência, dada a proximidade",ATENDIMENTO=SIM; supplied by cold chain network,BAHIA,São Domingos,Hospital São Domingos,Praça Izaque Pinheiro,75 98265-6665,"É suprido pela rede de frio quando do atendimento de ocorrência, dada a proximidade","Hospital São Domingos, Praça Izaque Pinheiro, São Domingos, BAHIA, Brasil",,false,OK,"Praça Izaque - São Domingos, BA, 48895-000, Brasil",-11.4632917,-39.52799,ChIJmfOh3LRtEwcRUeLaS8bcYI4,true,APPROXIMATE,town_square,google_maps_geocoding_v1,2026-04-19T14:50:07Z,,,,,,,,false,,,retry_queue,publish
BA_0213,BA.json,BA,BAHIA,São Francisco do Conde,Hospital Municipal de São Francisco do Conde (Hosp. Célia Almeida Lima),"Rua Rodolfo Tourinho, s/n – Centro",(71) 3651-8556/8553/8555/8554,2520168,"É suprido pela rede de frio quando do atendimento de ocorrência, dada a proximidade",ATENDIMENTO=SIM; supplied by cold chain network,BAHIA,São Francisco do Conde,Hospital Municipal de São Francisco do Conde (Hosp. Célia Almeida Lima),"Rua Rodolfo Tourinho, s/n – Centro",(71) 3651-8556/8553/8555/8554,"É suprido pela rede de frio quando do atendimento de ocorrência, dada a proximidade","Hospital Municipal de São Francisco do Conde (Hosp. Célia Almeida Lima), Rua Rodolfo Tourinho, s/n – Centro, São Francisco do Conde, BAHIA, Brasil",,false,OK,"R. Rodolfo Tourinho - São Francisco do Conde, BA, 43900-000, Brasil",-12.6264591,-38.6757746,ChIJ_8fShVDYFQcRbYwu7aNGwXs,true,GEOMETRIC_CENTER,establishment|health|hospital|point_of_interest,google_maps_geocoding_v1,2026-04-19T14:50:08Z,,,,,,,,false,,,retry_queue,publish
BA_0214,BA.json,BA,BAHIA,São Sebastião do Passé,Hospital Albino Leitão,"Praça Coronel Luiz Ventura, 78 – Centro",(71) 3655-1121,2493330,Botrópico|Crotálico|Escorpiônico e Araneídico,ATENDIMENTO=SIM,BAHIA,São Sebastião do Passé,Hospital Albino Leitão,"Praça Coronel Luiz Ventura, 78 – Centro",(71) 3655-1121,"Botrópico, Crotálico, Escorpiônico e Araneídico","Hospital Albino Leitão, Praça Coronel Luiz Ventura, 78 – Centro, São Sebastião do Passé, BAHIA, Brasil",,false,OK,"Praça Coronel Luiz Ventura - São Sebastião do Passé, BA, 43850-000, Brasil",-12.5186451,-38.4875796,ChIJe0n3P9d8FgcRbmDtnNIBlsA,true,APPROXIMATE,town_square,google_maps_geocoding_v1,2026-04-19T14:50:08Z,,,,,,,,false,,,retry_queue,publish
BA_0215,BA.json,BA,BAHIA,Sapeaçu,Hospital Municipal de Sapeaçu,"Rua Francisco Tupinambá, 92 - Pq. Mangueiras",(75) 3627-2241/ (75) 99963-2424,2523051,Botrópico|Crotálico|Elapídico|Escorpiônico|Araneídico,ATENDIMENTO=SIM,BAHIA,Sapeaçu,Hospital Municipal de Sapeaçu,"Rua Francisco Tupinambá, 92 - Pq. Mangueiras",(75) 3627-2241/ (75) 99963-2424,"Botrópico, Crotálico, Elapídico, Escorpiônico, Araneídico","Hospital Municipal de Sapeaçu, Rua Francisco Tupinambá, 92 - Pq. Mangueiras, Sapeaçu, BAHIA, Brasil",,false,OK,"Sapeaçu, BA, 44530-000, Brasil",-12.7314563,-39.1869934,ChIJAZJmqpGZFQcRRASHKjeR7oY,true,APPROXIMATE,locality|political,google_maps_geocoding_v1,2026-04-19T14:50:08Z,,,,,,,,false,,,retry_queue,publish
BA_0216,BA.json,BA,BAHIA,Sátiro Dias,Hospital Municipal de Sátiro Dias,"Alto da Saudade, 1 - Centro",,7223676,Botrópico|Crotálico|Elapídico|Escorpiônico|Araneídico,ATENDIMENTO=SIM; phone marked 'não disponível',BAHIA,Sátiro Dias,Hospital Municipal de Sátiro Dias,"Alto da Saudade, 1 - Centro",,"Botrópico, Crotálico, Elapídico, Escorpiônico, Araneídico","Hospital Municipal de Sátiro Dias, Alto da Saudade, 1 - Centro, Sátiro Dias, BAHIA, Brasil",phones empty,false,OK,"Unnamed Road, 48485-000, Sátiro Dias - BA, 48485-000, Brasil",-11.6066764,-38.5830523,ChIJHXRG0Q9fEQcRpmkwr8QwlMk,true,GEOMETRIC_CENTER,establishment|health|hospital|point_of_interest,google_maps_geocoding_v1,2026-04-19T14:50:09Z,,,,,,,,false,,,retry_queue,publish
BA_0223,BA.json,BA,BAHIA,Serra Dourada,Hospital Municipal Antonio Souza Fagundes,"Praça Pedro José de Aquino, 493 - Centro",(77) 3686-2072,4037594,Botrópico|Crotálico|Escorpiônico e Araneídico,ATENDIMENTO=SIM,BAHIA,Serra Dourada,Hospital Municipal Antonio Souza Fagundes,"Praça Pedro José de Aquino, 493 - Centro",(77) 3686-2072,"Botrópico, Crotálico, Escorpiônico e Araneídico","Hospital Municipal Antonio Souza Fagundes, Praça Pedro José de Aquino, 493 - Centro, Serra Dourada, BAHIA, Brasil",,false,OK,"R. Antônio de Souza Fagundes, Serra Dourada - BA, 47740-000, Brasil",-12.7563595,-43.9496306,ChIJXWe2zIyPXgcR6UJrUsX5c0s,true,GEOMETRIC_CENTER,route,google_maps_geocoding_v1,2026-04-19T14:50:10Z,,,,,,,,false,,,retry_queue,publish
BA_0224,BA.json,BA,BAHIA,Serrinha,Hospital Municipal de Serrinha,Rodovia BA 409 KM 01 - BA Serrinha-Coité,(75) 3261-2224,2801914,Botrópico|Crotálico|Elapídico|Escorpiônico|Araneídico,ATENDIMENTO=SIM,BAHIA,Serrinha,Hospital Municipal de Serrinha,Rodovia BA 409 KM 01 - BA Serrinha-Coité,(75) 3261-2224,"Botrópico, Crotálico, Elapídico, Escorpiônico, Araneídico","Hospital Municipal de Serrinha, Rodovia BA 409 KM 01 - BA Serrinha-Coité, Serrinha, BAHIA, Brasil",,false,OK,"Hospital Municipal de, Serrinha - BA, 48700-000, Brasil",-11.6643108,-39.0236172,ChIJJU1B-gWNEwcR3_FWOE5BaSI,true,GEOMETRIC_CENTER,establishment|health|hospital|point_of_interest,google_maps_geocoding_v1,2026-04-19T14:50:11Z,,,,,,,,false,,,retry_queue,publish
BA_0227,BA.json,BA,BAHIA,Sítio do Mato,Hospital Municipal Maria Pereira Macedo,"Rua das Flores, s/n - Centro",(77) 3671-2391,3208419,Botrópico|Crotálico|Escorpiônico e Araneídico,ATENDIMENTO=SIM,BAHIA,Sítio do Mato,Hospital Municipal Maria Pereira Macedo,"Rua das Flores, s/n - Centro",(77) 3671-2391,"Botrópico, Crotálico, Escorpiônico e Araneídico","Hospital Municipal Maria Pereira Macedo, Rua das Flores, s/n - Centro, Sítio do Mato, BAHIA, Brasil",,false,OK,"R. das Flôres - Sítio do Mato, BA, 47610-000, Brasil",-13.084664,-43.4688003,ChIJFU5-ZV5rXAcRVYmQxR7e2f8,true,GEOMETRIC_CENTER,route,google_maps_geocoding_v1,2026-04-19T14:50:12Z,,,,,,,,false,,,retry_queue,publish
BA_0232,BA.json,BA,BAHIA,Tapiramutá,Hospital Municipal Dr. José Nery,"Av. Cafeeira, s/n - Centro",74 98138-0329,2524805,Botrópico|Crotálico,ATENDIMENTO=SIM,BAHIA,Tapiramutá,Hospital Municipal Dr. José Nery,"Av. Cafeeira, s/n - Centro",74 98138-0329,"Botrópico, Crotálico","Hospital Municipal Dr. José Nery, Av. Cafeeira, s/n - Centro, Tapiramutá, BAHIA, Brasil",,false,OK,"Av. Cafeeira - Tapiramutá, BA, 44840-000, Brasil",-11.8491791,-40.7938573,ChIJJwaknlGjawcRpc6c_8Wi6S8,false,GEOMETRIC_CENTER,establishment|health|hospital|point_of_interest,google_maps_geocoding_v1,2026-04-19T14:50:13Z,,,,,,,,false,,,watchlist,publish
BA_0234,BA.json,BA,BAHIA,Teixeira de Freitas,Unidade Municipal Materno Infantil (UMMI),"Av. Presidente Getúlio Vargas, s/nº - Jardim Liberdade",(73) 3291-2763,5005027,Botrópico|Escorpiônico,ATENDIMENTO=SIM,BAHIA,Teixeira de Freitas,Unidade Municipal Materno Infantil (UMMI),"Av. Presidente Getúlio Vargas, s/nº - Jardim Liberdade",(73) 3291-2763,"Botrópico, Escorpiônico","Unidade Municipal Materno Infantil (UMMI), Av. Presidente Getúlio Vargas, s/nº - Jardim Liberdade, Teixeira de Freitas, BAHIA, Brasil",,false,OK,"R. Visc. de Cayru - Vila Vargas, Teixeira de Freitas - BA, 45998, Brasil",-17.5300175,-39.7609479,ChIJmWCfyBNENQcR3ACbdwI9qOA,true,GEOMETRIC_CENTER,establishment|health|hospital|point_of_interest,google_maps_geocoding_v1,2026-04-19T14:50:14Z,,,,,,,,false,,,retry_queue,publish
BA_0237,BA.json,BA,BAHIA,Tucano,Hospital Mariano Penedo,"Av. Padre José Gumercindo dos Santos, s/n - Centro",(75) 3272-2240,2814056,"É suprido pela rede de frio quando do atendimento de ocorrência, dada a proximidade",ATENDIMENTO=SIM; supplied by cold chain network,BAHIA,Tucano,Hospital Mariano Penedo,"Av. Padre José Gumercindo dos Santos, s/n - Centro",(75) 3272-2240,"É suprido pela rede de frio quando do atendimento de ocorrência, dada a proximidade","Hospital Mariano Penedo, Av. Padre José Gumercindo dos Santos, s/n - Centro, Tucano, BAHIA, Brasil",,false,OK,"Tucano - BA, 48790-000, Brasil",-10.9620193,-38.7915298,ChIJO_aLEFM7EgcREhOM79mcbRY,true,APPROXIMATE,administrative_area_level_2|political,google_maps_geocoding_v1,2026-04-19T14:50:15Z,,,,,,,,false,,,retry_queue,publish
BA_0238,BA.json,BA,BAHIA,Uauá,Hospital Municipal de Uauá (Hosp. Munic. Dr Jair Braga),"Rua do Forum, s/n – Centro",(74) 3673-1113,2525259,Botrópico|Crotálico|Elapídico|Escorpiônico|Araneídico,ATENDIMENTO=SIM,BAHIA,Uauá,Hospital Municipal de Uauá (Hosp. Munic. Dr Jair Braga),"Rua do Forum, s/n – Centro",(74) 3673-1113,"Botrópico, Crotálico, Elapídico, Escorpiônico, Araneídico","Hospital Municipal de Uauá (Hosp. Munic. Dr Jair Braga), Rua do Forum, s/n – Centro, Uauá, BAHIA, Brasil",,false,OK,"R. do Forum - Uauá, BA, 48950-000, Brasil",-9.8389174,-39.4826789,ChIJqXhITtT6DAcRlZFJgKFR5yU,true,GEOMETRIC_CENTER,route,google_maps_geocoding_v1,2026-04-19T14:50:15Z,,,,,,,,false,,,retry_queue,publish
BA_0240,BA.json,BA,BAHIA,Una,Hospital Municipal Frei Silvério,"Rua Morro Grande, s/n-Centro",(73) 3236-2247,2800527,Botrópico,ATENDIMENTO=SIM,BAHIA,Una,Hospital Municipal Frei Silvério,"Rua Morro Grande, s/n-Centro",(73) 3236-2247,Botrópico,"Hospital Municipal Frei Silvério, Rua Morro Grande, s/n-Centro, Una, BAHIA, Brasil",,false,OK,"Hospital Municipal Frei Silvério - BA-001, S/N - Morro Grande, Una - BA, 45690-000, Brasil",-15.2979541,-39.0728253,ChIJgW50LGLbOQcR386PD2linL4,true,GEOMETRIC_CENTER,premise|street_address,google_maps_geocoding_v1,2026-04-19T14:50:15Z,,,,,,,,false,,,retry_queue,publish
BA_0241,BA.json,BA,BAHIA,Urandi,Hospital Municipal de Urandi (Hosp. Munic. Padre Antônio Manoel da Rocha),"Praça Deputado Henrique Brito, 160 – DC5",(77) 3456-2184,4033418,Botrópico|Crotálico|Elapídico|Escorpiônico|Araneídico,ATENDIMENTO=SIM,BAHIA,Urandi,Hospital Municipal de Urandi (Hosp. Munic. Padre Antônio Manoel da Rocha),"Praça Deputado Henrique Brito, 160 – DC5",(77) 3456-2184,"Botrópico, Crotálico, Elapídico, Escorpiônico, Araneídico","Hospital Municipal de Urandi (Hosp. Munic. Padre Antônio Manoel da Rocha), Praça Deputado Henrique Brito, 160 – DC5, Urandi, BAHIA, Brasil",,false,OK,"Urandi, BA, 46350-000, Brasil",-14.7673594,-42.6588314,ChIJoecGavMEUAcRTGnWHt3HO4Q,true,APPROXIMATE,town_square,google_maps_geocoding_v1,2026-04-19T14:50:16Z,,,,,,,,false,,,retry_queue,publish
BA_0246,BA.json,BA,BAHIA,Várzea do Poço,Hospital Municipal Rivorge Gonçalves Lima,"Av Valter Andrade de Almeida,s/n - Centro - Várzea do Poço",(74) 3639-2110,2644835,"É suprido pela rede de frio quando do atendimento de ocorrência, dada a proximidade",ATENDIMENTO=SIM; supplied by cold chain network,BAHIA,Várzea do Poço,Hospital Municipal Rivorge Gonçalves Lima,"Av Valter Andrade de Almeida,s/n - Centro - Várzea do Poço",(74) 3639-2110,"É suprido pela rede de frio quando do atendimento de ocorrência, dada a proximidade","Hospital Municipal Rivorge Gonçalves Lima, Av Valter Andrade de Almeida,s/n - Centro - Várzea do Poço, Várzea do Poço, BAHIA, Brasil",,false,OK,"Várzea do Poço - BA, 44715-000, Brasil",-11.5253848,-40.3094128,ChIJYaAaMkqfbAcRUIOfIX2rmWs,true,GEOMETRIC_CENTER,establishment|health|hospital|point_of_interest,google_maps_geocoding_v1,2026-04-19T14:50:17Z,,,,,,,,false,,,retry_queue,publish
BA_0247,BA.json,BA,BAHIA,Várzea Nova,Hospital Padre Alfredo Haasler,"Av. Antero da Rocha Montenegro, 286 – Centro",(74) 3659-2196,2526093,"É suprido pela rede de frio quando do atendimento de ocorrência, dada a proximidade",ATENDIMENTO=SIM; supplied by cold chain network,BAHIA,Várzea Nova,Hospital Padre Alfredo Haasler,"Av. Antero da Rocha Montenegro, 286 – Centro",(74) 3659-2196,"É suprido pela rede de frio quando do atendimento de ocorrência, dada a proximidade","Hospital Padre Alfredo Haasler, Av. Antero da Rocha Montenegro, 286 – Centro, Várzea Nova, BAHIA, Brasil",,false,OK,"R. Manoel Silvestre de Oliveira, Várzea Nova - BA, 44690-000, Brasil",-11.2489193,-40.9443679,ChIJU_hQZqRsbAcR4SSfIpNC8jw,true,GEOMETRIC_CENTER,establishment|health|hospital|point_of_interest,google_maps_geocoding_v1,2026-04-19T14:50:17Z,,,,,,,,false,,,retry_queue,publish
BA_0249,BA.json,BA,BAHIA,Vereda,PSF II Idalina da Rocha Nonato,Rua Professor Tertuliano Pereira de Queiroz,(73) 3661-2111,2525666,Botrópico|Escorpiônico,ATENDIMENTO=SIM,BAHIA,Vereda,PSF II Idalina da Rocha Nonato,Rua Professor Tertuliano Pereira de Queiroz,(73) 3661-2111,"Botrópico, Escorpiônico","PSF II Idalina da Rocha Nonato, Rua Professor Tertuliano Pereira de Queiroz, Vereda, BAHIA, Brasil",,false,OK,"R. Prof. Tertuliano Pereira de Queiróz - Vereda, BA, 45955-000, Brasil",-17.2255081,-40.0864143,ChIJ5XnInTebSgcRxOKQWOi4Vpw,true,GEOMETRIC_CENTER,route,google_maps_geocoding_v1,2026-04-19T14:50:18Z,,,,,,,,false,,,retry_queue,publish
CE_0004,CE.json,CE,CEARÁ,Baixio,Hospital São Francisco - Unidade Mista do Baixio,"R. Dona Maria da Glória, s/n - Centro",(88) 3539-1129,2552345,Crotálico|Laquético|Escorpiônico|Fonêutrico|Lonômico|Loxoscélico,,CEARÁ,Baixio,Hospital São Francisco - Unidade Mista do Baixio,"R. Dona Maria da Glória, s/n - Centro",(88) 3539-1129,"Crotálico, Laquético, Escorpiônico, Fonêutrico, Lonômico, Loxoscélico","Hospital São Francisco - Unidade Mista do Baixio, R. Dona Maria da Glória, s/n - Centro, Baixio, CEARÁ, Brasil",,false,OK,"R. Dona Maria da Glória, Baixio - CE, 63320-000, Brasil",-6.728783399999999,-38.7156281,ChIJwy7yS-uGowcRzJW3y75wgdA,true,GEOMETRIC_CENTER,establishment|health|hospital|point_of_interest,google_maps_geocoding_v1,2026-04-19T14:50:21Z,,,,,,,,false,,,retry_queue,publish
CE_0005,CE.json,CE,CEARÁ,Aracoiaba,Hospital e Maternidade Santa Isabel,"R. Getúlio Vargas, 139 - Centro",(85) 3337-1415,4010779,Crotálico|Laquético|Escorpiônico|Fonêutrico|Lonômico|Loxoscélico,,CEARÁ,Aracoiaba,Hospital e Maternidade Santa Isabel,"R. Getúlio Vargas, 139 - Centro",(85) 3337-1415,"Crotálico, Laquético, Escorpiônico, Fonêutrico, Lonômico, Loxoscélico","Hospital e Maternidade Santa Isabel, R. Getúlio Vargas, 139 - Centro, Aracoiaba, CEARÁ, Brasil",,false,OK,"R. Getúlio Vargas - Aracoiaba, CE, 62750-000, Brasil",-4.3739097,-38.8099136,ChIJ81HDhncvvwcR1vlz68ivUCQ,true,GEOMETRIC_CENTER,establishment|health|hospital|point_of_interest,google_maps_geocoding_v1,2026-04-19T14:50:21Z,,,,,,,,false,,,retry_queue,publish
CE_0006,CE.json,CE,CEARÁ,Brejo Santo,Hospital Geral de Brejo Santo,"Av. Pref. João Inácio de Lucena, 1255 - Centro",(88) 3531-1082,2480646,Crotálico|Laquético|Escorpiônico|Fonêutrico|Lonômico|Loxoscélico,,CEARÁ,Brejo Santo,Hospital Geral de Brejo Santo,"Av. Pref. João Inácio de Lucena, 1255 - Centro",(88) 3531-1082,"Crotálico, Laquético, Escorpiônico, Fonêutrico, Lonômico, Loxoscélico","Hospital Geral de Brejo Santo, Av. Pref. João Inácio de Lucena, 1255 - Centro, Brejo Santo, CEARÁ, Brasil",,false,OK,"Hospital Geral De Brejo Santo - Aldeota, Brejo Santo - CE, 63260-000, Brasil",-7.485720600000001,-38.984251,ChIJQ4E-Xyk-oQcRfNdv211_Yu0,true,GEOMETRIC_CENTER,premise|street_address,google_maps_geocoding_v1,2026-04-19T14:50:21Z,,,,,,,,false,,,retry_queue,publish
CE_0009,CE.json,CE,CEARÁ,Carnaubal,Unidade Mista Nossa Senhora Auxiliadora,"Av. Paulo Sarazate, 0 - Centro",(88) 3650-1134,2561298,Crotálico|Laquético|Escorpiônico|Fonêutrico|Lonômico|Loxoscélico,,CEARÁ,Carnaubal,Unidade Mista Nossa Senhora Auxiliadora,"Av. Paulo Sarazate, 0 - Centro",(88) 3650-1134,"Crotálico, Laquético, Escorpiônico, Fonêutrico, Lonômico, Loxoscélico","Unidade Mista Nossa Senhora Auxiliadora, Av. Paulo Sarazate, 0 - Centro, Carnaubal, CEARÁ, Brasil",,false,OK,"Carnaubal - CE, 62375-000, Brasil",-4.1595965,-40.9406594,ChIJPZFDJxHtlAcRFMAo7XA1DRI,true,GEOMETRIC_CENTER,establishment|health|hospital|point_of_interest,google_maps_geocoding_v1,2026-04-19T14:50:22Z,,,,,,,,false,,,retry_queue,publish
CE_0010,CE.json,CE,CEARÁ,Catarina,Hospital Municipal Doutor Gentil,"R. Francisco Chagas Guedes, 441",(88) 3556-1112,2333864,Crotálico|Laquético|Escorpiônico|Fonêutrico|Lonômico|Loxoscélico,,CEARÁ,Catarina,Hospital Municipal Doutor Gentil,"R. Francisco Chagas Guedes, 441",(88) 3556-1112,"Crotálico, Laquético, Escorpiônico, Fonêutrico, Lonômico, Loxoscélico","Hospital Municipal Doutor Gentil, R. Francisco Chagas Guedes, 441, Catarina, CEARÁ, Brasil",,false,OK,"R. Francisco Chagas Guedes, 441, Catarina - CE, 63595-000, Brasil",-6.1328155,-39.8750883,EkFSLiBGcmFuY2lzY28gQ2hhZ2FzIEd1ZWRlcywgNDQxLCBDYXRhcmluYSAtIENFLCA2MzU5NS0wMDAsIEJyYXppbCIxEi8KFAoSCVd_7w6SpaIHEVNkiXqhOqpNELkDKhQKEgkZVZ-HjaWiBxGOKhM-Yn1kAQ,true,RANGE_INTERPOLATED,street_address,google_maps_geocoding_v1,2026-04-19T14:50:22Z,,,,,,,,false,,,retry_queue,publish
CE_0018,CE.json,CE,CEARÁ,Ibiapina,Hospital Municipal Maria Wanderlene Negreiros de Queiroz,"Av. Dep. Fernando Melo, s/n - Centro",(88) 3653-1130,2561336,Crotálico|Laquético|Escorpiônico|Fonêutrico|Lonômico|Loxoscélico,,CEARÁ,Ibiapina,Hospital Municipal Maria Wanderlene Negreiros de Queiroz,"Av. Dep. Fernando Melo, s/n - Centro",(88) 3653-1130,"Crotálico, Laquético, Escorpiônico, Fonêutrico, Lonômico, Loxoscélico","Hospital Municipal Maria Wanderlene Negreiros de Queiroz, Av. Dep. Fernando Melo, s/n - Centro, Ibiapina, CEARÁ, Brasil",,false,OK,"Av. Dep. Fernando Melo - Centro, Ibiapina - CE, 62360-000, Brasil",-3.922421,-40.8892731,EkFBdi4gRGVwLiBGZXJuYW5kbyBNZWxvIC0gQ2VudHJvLCBJYmlhcGluYSAtIENFLCA2MjM2MC0wMDAsIEJyYXppbCIuKiwKFAoSCdFDU0zYyJQHEXUrEB-glqv8EhQKEgkBaFR1JsmUBxHM5RRKfwnHLQ,true,GEOMETRIC_CENTER,route,google_maps_geocoding_v1,2026-04-19T14:50:25Z,,,,,,,,false,,,retry_queue,publish
